question_id,question_name
5228,Is food provided to the group’s adherents by an institution(s) other than the religious group in question:
5229,Please characterize the forms/levels of food production [choose all that apply]:
5155,"On average, for large-scale rituals how many participants gather in one location:"
5156,What is the average interval of time between performances (in hours):
5157,Are there orthodoxy checks:
5158,Are there orthopraxy checks:
5159,Does participation entail synchronic practices:
5160,Is there use of intoxicants:
4870,Human spirits' knowledge restricted to particular domain of human affairs:
4871,Human spirits' knowledge restricted to (a) specific area(s) within the sample region:
4872,Human spirits' knowledge unrestricted within the sample region:
4873,Human spirits' knowledge unrestricted outside of sample region:
4874,Human spirits can see you everywhere normally visible (in public):
4875,"Human spirits can see you everywhere (in the dark, at home):"
4876,Human spirit's can see inside heart/mind (hidden motives):
4877,Human spirits know your basic character (personal essence):
4878,"Human spirits know what will happen to you, what you will do (future sight):"
4879,Human spirits have other form(s) of knowledge regarding this world:
4881,Human spirits can reward:
4882,Human spirits can punish:
5047,Is the messiah's whereabouts or time of coming known?
5055,Is the messiah's purpose known:
5056,Messiah is a political figure who restores political rule:
5057,Messiah is a priestly figure who restores religious traditions:
5058,Other purpose:
5185,Is extra-religious education open to both males and females:
5207,Do the institutionalized punishments include execution:
5208,Do the institutionalized punishments include exile:
5209,Do the institutionalized punishments include corporal punishments:
5210,Do the institutionalized punishments include ostracism:
5211,Do the institutionalized punishments include seizure of property:
5144,To other in-group members:
5145,To out-groups:
5146,Destroyed:
5147,Other:
4704,"Multiple religious communities each with its own leader, no hierarchy among these leaders:"
4705,"""Regional"" leaders who oversee one or more local leader(s) (e.g. bishops):"
4706,A single leader for the religious group that oversees all other leaders in the sample region:
4707,A council or group of leaders for the religious group that oversees all other leaders in the sample region:
4708,Estimate how many levels there are in the hierarchy of religious leadership:
4723,Communication with supernatural power(s) believed to be part of the selection process:
4725,Charges of fallibility made by a leader's own followers:
4726,Charges of fallibility made by other leaders in the religious group:
4727,Charges of fallibility made by a political ruler:
4788,In a human form:
4789,In animal/plant form:
4790,In form of an inanimate object(s):
4791,"In non-individual form (i.e. some form of corporate rebirth, tribe, lineage. etc.):"
4792,Reincarnation linked to notion of life-transcending causality (e.g. karma):
4793,Other form of reincarnation in this world:
4809,Human sacrifices present:
4813,Animal co-sacrifices present:
4817,"Significant wealth (e.g. gold, jade, intensely worked objects):"
4818,Some wealth (some valuable or useful objects interred):
4819,Other valuable/precious items interred:
4920,These mixed human-divine beings can be seen:
4921,These mixed human-divine beings can be physically felt:
4922,Mixed human-divine beings have knowledge of this world:
4923,Mixed human-divine beings have knowledge restricted to particular domain of human affairs:
4924,Mixed human-divine beings have knowledge restricted to (a) specific area(s) within the sample region:
4925,Mixed human-divine beings have knowledge unrestricted within the sample region:
4926,Mixed human-divine beings have knowledge unrestricted outside of sample region:
4927,Mixed human-divine beings can see you everywhere normally visible (in public):
4928,"Mixed human-divine beings can see you everywhere (in the dark, at home):"
4929,Mixed human-divine beings can see inside heart/mind (hidden motives):
4930,Mixed human-divine beings know your basic character (personal essence):
4931,"Mixed human-divine beings know what will happen to you, what you will do (future sight):"
4932,Mixed human-divine beings have other knowledge of the human world:
4933,These mixed human-divine beings have deliberate causal efficacy in the world:
4934,These mixed human-divine beings can reward:
4935,These mixed human-divine beings can punish:
4936,These mixed human-divine beings have indirect causal efficacy in the world:
4937,These mixed human-divine beings exhibit positive emotion:
4938,These mixed human-divine beings exhibit negative emotion:
4939,These mixed human-divine beings possess hunger:
4940,These mixed human-divine beings possess/exhibit some other feature:
4941,Mixed human-divine beings communicate with the living:
4942,"In waking, everyday life:"
4943,In dreams:
4944,In trance possession:
4945,Through divination practices:
4946,Only through religious specialists:
4947,Only through monarch:
4948,Other form of communication with living:
5171,Fictive kinship terminology universal:
5172,Fictive kinship terminology widespread:
5173,Fictive kinship terminology employed but uncommon:
4742,Interpretation is only allowed by officially sanctioned figures:
5162,Tattoos/scarification:
5163,Circumcision:
5164,Food taboos:
5165,Hair:
5166,Dress:
5167,Ornaments:
5168,Archaic ritual language:
5169,Other:
4674,Does the coercion take the form of physical force:
4675,Does the coercion take the form of economic sanctions:
4710,Powers are acquired by individual deeds carried out in past lives:
4711,Powers are acquired by individual deeds carried out in the current life:
4712,Powers are inherited:
4713,Powers are culturally transmitted from a supernatural being:
4714,Powers are culturally transmitted from another human (e.g. teacher):
4715,Powers are associated with leadership office they assume:
5221,Is use of this distinct written language confined to religious professionals:
5060,Eschaton in this lifetime:
5061,Eschaton at specified time in future:
5062,Eschaton at unspecified time in near future:
5063,Eschaton at unspecified time in distant future:
5064,Eschaton at some other time:
5065,Adherents need to perform specific tasks to bring about World's end:
5066,Divine judgment event:
5067,Restoration of the world:
5068,Start of a new temporal cycle:
5069,Establishment of a new political system:
5070,Establishment of a new religious system:
5071,Will anyone survive the eschaton:
5072,All religious in-group members will survive the eschaton:
5073,A subset of religion in-group members will survive the eschaton:
5074,All members of the sample region will survive the eschaton:
5075,Everyone in the world will survive the eschaton:
5076,Other survival condition:
5048,"Alive, identified:"
5049,Coming in this lifetime:
5050,Coming on specified date:
5051,Coming in unspecified time in near future:
5052,Coming in unspecified time in distant future:
5053,Coming has already passed:
5054,One in a line of many past and future messiahs:
4810,Out-group humans are sacrificed:
4811,In-group humans are sacrificed:
4812,Other humans are sacrificed:
5138,"Foreign, slaves:"
5139,Commoners:
5140,Elites:
5141,Other:
